{
  "$schema": "http://json-schema.org/draft-07/schema#",
  "$id": "https://raw.githubusercontent.com/wpromote/opencode-config/main/wpromote.schema.json",
  "title": "Wpromote OpenCode Configuration",
  "description": "Configuration for @wpro-eng/opencode-config — the Wpromote OpenCode plugin that syncs team assets on startup. Place this file at .opencode/wpromote.json (or .jsonc) in your project, or at ~/.config/opencode/wpromote.json globally.",
  "type": "object",
  "additionalProperties": false,
  "properties": {
    "$schema": {
      "type": "string",
      "description": "Path or URL to this JSON Schema for editor autocompletion."
    },
    "disable": {
      "type": "array",
      "description": "Asset disable list. Entries can be typed (\"skill:example\"), untyped (\"example\"), glob patterns (\"skill:deprecated-*\"), or negated (\"!skill:keep-this\"). Later entries override earlier ones.",
      "default": [],
      "items": {
        "type": "string",
        "examples": [
          "skill:example",
          "agent:heavy",
          "instruction:**/*.md",
          "!skill:keep-this",
          "mcp:my-mcp",
          "plugin:unused",
          "internal-*"
        ]
      },
      "examples": [
        ["skill:example"],
        ["skill:deprecated-*", "!skill:deprecated-but-keep"],
        ["instruction:**/*.md"]
      ]
    },
    "agentOverrides": {
      "type": "object",
      "description": "Partial patch-style overrides applied to team agent configs before injection. Use this to change specific values (for example temperature) without redefining the whole agent. Built-in team agents accept either descriptive or LOTR names as keys (for example `planner` or `treebeard`). Local opencode.json agent entries still take precedence and fully replace the team agent config.",
      "default": {},
      "additionalProperties": {
        "type": "object",
        "description": "Partial agent config patch for a team agent name.",
        "additionalProperties": true,
        "properties": {
          "model": {
            "type": "string"
          },
          "temperature": {
            "type": "number",
            "minimum": 0,
            "maximum": 2
          },
          "top_p": {
            "type": "number",
            "minimum": 0,
            "maximum": 1
          },
          "prompt": {
            "type": "string"
          },
          "tools": {
            "type": "object",
            "additionalProperties": {
              "type": "boolean"
            }
          },
          "disable": {
            "type": "boolean"
          },
          "description": {
            "type": "string"
          },
          "mode": {
            "type": "string",
            "enum": ["subagent", "primary", "all"]
          },
          "options": {
            "type": "object",
            "additionalProperties": true
          },
          "color": {
            "type": "string",
            "pattern": "^#[0-9a-fA-F]{6}$"
          },
          "steps": {
            "type": "integer",
            "minimum": 1
          },
          "maxSteps": {
            "type": "integer",
            "minimum": 1
          },
          "permission": {
            "description": "Permission config. Supports full replacement of top-level keys; nested objects merge with team defaults during apply.",
            "oneOf": [
              {
                "type": "string",
                "enum": ["ask", "allow", "deny"]
              },
              {
                "type": "object",
                "additionalProperties": {
                  "oneOf": [
                    {
                      "type": "string",
                      "enum": ["ask", "allow", "deny"]
                    },
                    {
                      "type": "object",
                      "additionalProperties": {
                        "type": "string",
                        "enum": ["ask", "allow", "deny"]
                      }
                    }
                  ]
                }
              }
            ]
          }
        }
      },
      "examples": [
        {
          "planner": {
            "temperature": 0.2
          }
        },
        {
          "researcher": {
            "model": "github-copilot/gpt-5.2",
            "temperature": 0.3
          }
        }
      ]
    },
    "installMethod": {
      "type": "string",
      "enum": ["link", "copy"],
      "default": "link",
      "description": "How skills, plugins, and MCPs are installed locally. \"link\" creates symlinks (default, faster, auto-updates with package). \"copy\" creates independent copies."
    },
    "agentNames": {
      "type": "string",
      "enum": ["lotr", "descriptive"],
      "default": "descriptive",
      "description": "Agent naming theme. \"descriptive\" uses role-based names (orchestrator, explorer, etc.). \"lotr\" uses Tolkien character names (gandalf, legolas, etc.)."
    },
    "dryRun": {
      "type": "boolean",
      "default": false,
      "description": "When true, analyzes what would change without writing any files. Useful for previewing sync behavior."
    },
    "models": {
      "type": "object",
      "default": {},
      "description": "Override the model used by team agents. Built-in team agents accept either descriptive or LOTR names as keys (for example `orchestrator` or `gandalf`), regardless of the active naming theme. Omitted agents or empty string values fall back to the plugin default.",
      "additionalProperties": {
        "type": "string"
      },
      "examples": [
        {
          "orchestrator": "anthropic/claude-opus-4",
          "explorer": "github-copilot/claude-sonnet-4.6"
        }
      ]
    },
    "orchestration": {
      "type": "object",
      "description": "Orchestration runtime configuration for delegation, concurrency, fallback, and tmux integration.",
      "default": {},
      "additionalProperties": false,
      "properties": {
        "providerMode": {
          "type": "string",
          "enum": ["copilot", "native"],
          "default": "copilot",
          "description": "Default provider routing mode for subagent tasks."
        },
        "features": {
          "type": "object",
          "description": "Feature toggles for orchestration capabilities.",
          "default": {},
          "additionalProperties": false,
          "properties": {
            "delegation": {
              "type": "boolean",
              "default": true,
              "description": "Enable task delegation to subagents."
            },
            "diagnostics": {
              "type": "boolean",
              "default": true,
              "description": "Enable the /diagnostics command."
            },
            "vision": {
              "type": "boolean",
              "default": true,
              "description": "Enable the vision multimodal analysis tool."
            },
            "continuousLoop": {
              "type": "boolean",
              "default": true,
              "description": "Enable continuous loop mode via /continue."
            },
            "selfHealing": {
              "type": "boolean",
              "default": true,
              "description": "Enable self-healing retry policies for failed tasks."
            }
          }
        },
        "limits": {
          "type": "object",
          "description": "Concurrency, retry, and timeout limits for delegated tasks.",
          "default": {},
          "additionalProperties": false,
          "properties": {
            "maxConcurrent": {
              "type": "integer",
              "minimum": 1,
              "maximum": 10,
              "default": 3,
              "description": "Maximum number of concurrent delegated subagent tasks."
            },
            "maxRetries": {
              "type": "integer",
              "minimum": 0,
              "maximum": 5,
              "default": 2,
              "description": "Maximum retry attempts per failed task."
            },
            "maxIterations": {
              "type": "integer",
              "minimum": 1,
              "maximum": 100,
              "default": 25,
              "description": "Maximum agentic iterations per task."
            },
            "retryBackoffMs": {
              "type": "integer",
              "minimum": 100,
              "maximum": 60000,
              "default": 1500,
              "description": "Delay in milliseconds between retry attempts."
            },
            "taskTimeoutMs": {
              "type": "integer",
              "minimum": 1000,
              "maximum": 900000,
              "default": 120000,
              "description": "Task timeout in milliseconds (default: 2 minutes)."
            }
          }
        },
        "runtimeFallback": {
          "type": "object",
          "description": "Provider fallback configuration. When the primary provider fails, the runtime can fall back to the next provider in the chain.",
          "default": {},
          "additionalProperties": false,
          "properties": {
            "enabled": {
              "type": "boolean",
              "default": true,
              "description": "Enable automatic provider fallback on errors."
            },
            "retryOnErrors": {
              "type": "array",
              "default": [400, 401, 403, 408, 429, 500, 502, 503, 504, 529],
              "description": "HTTP status codes that trigger a fallback attempt.",
              "items": {
                "type": "integer"
              }
            },
            "maxFallbackAttempts": {
              "type": "integer",
              "minimum": 1,
              "maximum": 5,
              "default": 2,
              "description": "Maximum number of fallback attempts before giving up."
            },
            "cooldownSeconds": {
              "type": "integer",
              "minimum": 0,
              "maximum": 600,
              "default": 30,
              "description": "Cooldown period in seconds between fallback attempts."
            },
            "timeoutSeconds": {
              "type": "integer",
              "minimum": 0,
              "maximum": 300,
              "default": 30,
              "description": "Timeout in seconds for each fallback attempt."
            },
            "notifyOnFallback": {
              "type": "boolean",
              "default": true,
              "description": "Show a notification when a fallback is triggered."
            },
            "providerOrder": {
              "type": "array",
              "default": ["copilot", "native"],
              "description": "Ordered list of providers to try. First provider is primary; subsequent providers are fallbacks.",
              "items": {
                "type": "string",
                "enum": ["copilot", "native"]
              }
            }
          }
        },
        "hooks": {
          "type": "object",
          "description": "Hook configuration for orchestration lifecycle events.",
          "default": {},
          "additionalProperties": false,
          "properties": {
            "disabled": {
              "type": "array",
              "default": [],
              "description": "List of hook names to disable.",
              "items": {
                "type": "string",
                "examples": [
                  "task-tracking",
                  "timeout-enforcement",
                  "fallback-engine",
                  "activity-feed"
                ]
              }
            },
            "telemetry": {
              "type": "boolean",
              "default": true,
              "description": "Enable telemetry counters for hook invocations."
            }
          }
        },
        "notifications": {
          "type": "object",
          "description": "Notification buffer settings.",
          "default": {},
          "additionalProperties": false,
          "properties": {
            "enabled": {
              "type": "boolean",
              "default": true,
              "description": "Enable the notification buffer."
            },
            "maxItems": {
              "type": "integer",
              "minimum": 10,
              "maximum": 500,
              "default": 100,
              "description": "Maximum number of notifications to retain."
            }
          }
        },
        "categories": {
          "type": "object",
          "description": "Per-category overrides for provider routing and concurrency limits. Category names are free-form strings (normalized to lowercase at runtime).",
          "default": {},
          "additionalProperties": false,
          "properties": {
            "routing": {
              "type": "object",
              "default": {},
              "description": "Map of category name to provider mode. Overrides the top-level providerMode for tasks in that category.",
              "additionalProperties": {
                "type": "string",
                "enum": ["copilot", "native"]
              },
              "examples": [
                { "quick": "native", "heavy": "copilot" }
              ]
            },
            "maxConcurrent": {
              "type": "object",
              "default": {},
              "description": "Map of category name to max concurrent tasks. Overrides the top-level limits.maxConcurrent for that category.",
              "additionalProperties": {
                "type": "integer",
                "minimum": 1,
                "maximum": 10
              },
              "examples": [
                { "quick": 1, "heavy": 2 }
              ]
            }
          }
        },
        "recovery": {
          "type": "object",
          "description": "Startup recovery configuration for orphaned tasks from prior sessions.",
          "default": {},
          "additionalProperties": false,
          "properties": {
            "autoResumeOnStart": {
              "type": "boolean",
              "default": true,
              "description": "Automatically recover queued/running/retrying tasks on startup by moving them back to queued state."
            }
          }
        },
        "tmux": {
          "type": "object",
          "description": "Tmux session management for subagent tasks. Each OpenCode session gets a dedicated tmux session, and each subagent task gets its own window.",
          "default": {},
          "additionalProperties": false,
          "properties": {
            "enabled": {
              "type": "boolean",
              "default": false,
              "description": "Enable tmux session management. Requires tmux to be installed."
            },
            "sessionPrefix": {
              "type": "string",
              "default": "wpo",
              "minLength": 2,
              "maxLength": 20,
              "pattern": "^[a-zA-Z0-9_-]+$",
              "description": "Prefix for tmux session names. Sessions are named {prefix}-{opencode-session-id}."
            }
          }
        }
      }
    }
  }
}
